{"format": "pace-cnn-v1", "source": "synthetic", "generator": {"name": "uniform-int8", "version": 1, "seed": 0, "index": 2}, "input": [-41, -16, -21, 109, 55, 127, -127, -22, 84, -29, -117, -30, -90, -37, 109, 28, -9, 35, -77, 42, -2, 71, 98, 41, 18, -59, 67, -107, 86, -23, 17, 20, 84, 106, -3, 60, -97, -47, -34, 75, 32, 39, -82, 22, -47, 91, -68, -95, 40, -2, -127, -107, 5, 61, 37, -46, 45, 69, -2, 109, -60, 91, -10, -8, -31, 30, 71, 101, -7, -99, -63, -11, -20, -53, -21, 65, 95, 124, -53, -4, -6, -12, 2, 53, -97, -63, 41, -47, 121, -86, -75, 99, -94, 1, -15, -60, -21, 31, 77, -127, -119, -35, -46, 56, 115, 118, 115, 45, -94, -96, 49, 40, -89, 55, -19, 47, 42, -93, -23, 22, 45, -29, 107, -99, -61, 123, 111, 43, 26, 87, -16, -127, 45, -22, 74, -82, 50, 104, 47, -21, -23, 41, 80, -32, 67, 111, 0, -98, 77, -95, -105, -19, 73, 21, -31, 31, -88, 94, -15, -32, -57, 115, -72, 53, -19, 18, 53, -69, 117, 61, 59, -92, 36, -114, 102, 63, 118, -66, 68, 43, 6, 15, -68, -19, -14, -12, -82, -93, 114, -50, -83, 41, 60, -31, -103, 63, 123, 114, -91, -87, -43, -80, -108, 48, 67, -63, -120, -37, -46, 105, -74, 106, 33, 108, 103, 64, 89, -116, -66, -58, -63, 33, -2, 112, 47, -63, 39, -122, -103, 51, 32, -81, -41, 97, -38, -67, -49, -96, 25, 59, 46, -76, 114, 6, 52, 120, -50, -10, 96, -53, 113, -72, 84, -2, 84, 65, 52, 59, 47, -99, -116, 23, 65, -65, 11, -35, 33, 78, 53, 83, 88, -13, -118, -65, -96, 96, 127, 90, 40, 26, 55, -21, 25, 74, -108, -28, 41, -81, 39, 115, 106, -48, -44, 48, 78, -32, -24, 120, 86, -2, 84, 17, 25, -8, -126, 98, -92, 82, -44, 10, -74, -84, 118, -42, 123, 89, -60, 121, 9, 99, -84, 117, -73, -109, 67, -21, -24, -126, 125, -111, 91, -54, 18, 20, -75, -26, 123, -24, -33, 120, 53, 127, 85, -110, -113, -39, 31, 72, 41, -36, -13, -7, 98, 4, -28, -95, -27, -13, -16, -35, -13, -23, 65, -31, 64, -128, 68, -66, -61, 49, -20, -53, 49, 125, 76, -21, 84, -36, 67, 118, -14, -77, 98, -11, -18, 78, -116, 115, -31, 110, 115, -121, -24, 0, 26, -112, -83, -19, 113, -121, -21, -56, -39, 42, 26, 88, -85, -72, 119, -24, -59, 19, -38, 69, -99, 75, 88, 126, 65, -44, 19, 12, 56, -66, -75, -127, -32, 57, -82, -11, -16, -7, -1, 3, 34, -90, -74, 58, 77, -106, 105, -111, -126, 60, 6, -31, 123, 92, -109, 83, 68, 99, 24, -78, -79, 2, 96, 117, 76, -89, 3, 86, 47, -71, 95, -52, -92, -12, 52, -2, -45, 90, 106, 87, -42, 38, 78, -13, -19, -58, -127, -59, -79, 65, 56, -35, -127, -17, -99, -52, -22, 123, 79, -25, -113, -19, 106, 95, -1, 86, 98, -96, -128, -125, -22, 93, -39, 55, 25, 108, 46, -26, -44, -73, -110, -1, 94, -85, -65, -78, 86, 54, -9, 109, -36, -56, 111, -77, -107, 95, -91, 15, 117, 43, 36, 24, 65, 55, 114, 91, -6, -106, -11, -9, 10, 82, 65, 84, 53, 87, -107, 6, 75, -64, -39, 116, 120, 111, 28, 55, 3, -17, 58, 105, 109, -50, 10, 113, 100, 58, -127, 77, -32, 56, -6, -97, -108, -102, 13, -97, -29, 116, -124, 29, 33, 107, 77, -59, -106, 7, -41, -30, -46, 56, -128, -84, 18, 72, 46, 67, -23, 42, -36, 90, 103, 127, -5, -95, -120, 84, -53, 4, 73, 86, 17, -27, -83, -111, -15, 74, 80, -91, 60, -9, 29, 54, -51, 59, 33, -116, -81, 16, -37, -106, -9, 122, -40, 4, -110, -21, -34, -26, 127, 124, -110, 61, -82, -22, 92, 58, -33, -82, -92, -26, -10, 72, -112, 78, -32, -59, 80, -2, -51, 16, 67, 91, -66, 37, -102, 5, -116, -77, -125, -2, 100, -120, 127, 38, -73, 124, -2, 23, -6, 81, 20, -28, -91, -97, -59, -29, 6, 89, -109, 34, 82, -62, 55, 68, -115, -65, 55, -64, -81, 69, 2, -50, -6, 65, 17, 127, 41, 88, 41, 78, 32, -94, -31, 8, 78, 63, 99, 98, -32, -8, -119, -73, -104, -45, -17, -18, -59, 59, 87, -89, -52, 88, 4, 122, 73, -46, 114, 102, 58, -89, 29, -81, -116, 125, 13, 22, -120, 107, 101, -2, -121, -54, 67, -64, -12, 80, -101, -105, -94, -106, 108, 28, 27, 105, 19, -68, 27, 70, -20, 47, 30, -78, -26, 51, -88, -53, -24, 4, -56, 24, 61, -84, 111, -37, -88, 52, 81, 60, 124, -78, -105, 23, -32, -99, 84, -76, 72, 110, -93, 28, -104, 109, -32, -125, -108, -96, 1, -100, -1, -43, 106, -87, 38, -14, 31, -38, -124, 45, 4, -125, 41, -16, -21, 110, -46, 90, -11, -67, -109, -78, 17, -59, -112, 101, -104, -32, 35, -94, -64, 112, 35, 74, 84, -38, 38, 33, 57, -18, -102, -124, 120, -52, -80, -18, -79, 121, 99, 3, -56, -35, 100, -92, 53, -107, 75, 25, 8, 40, -77, 32, -21, 55, 50, -91, -80, -33, -1, 4, -42, -74, 80, 44, 51, -24, -125, 93, 70, -16, 54, -60, 119, 126, -61, 124, -22, 91, 103, 2, 98, 30, -73, -77, 27, -79, -20, 79, -86, 48, 123, -1, 66, 66, -63, -83, 45, -109, 37, 2, -121, -31, 71, -70, -52, -45, -53, -70, 73, 18, 81, -16, -2, 39, -24, -123, -18, -82, 20, -35, 25, -8, 59, 80, 54, 125, 18, -119, 107, -124, -46, 84, -17, -34, -15, 104, 0, -43, 33, 79, -55, -25, -49, -111, -6, 94, 27, -85, 66, -16, 28, -66, -26, 98, -115, -36, 20, 19, -32, -116, 62, -20, 31, -85, 111, -64, 12, -93, -37, 82, -39, 99, -45, 36, 91, 0, -14, -74, -87, 16, -52, -95, 99, -11, -60, -96, 3, -91, 112, 104, -72, -11, 42, -25, 32, -17, 49, 81, -20, -5, -13, 101, 114, -57, 118, -71, 125, -75, 41, -120, 106, -128, 1, -82, 99, -47, 110, 69, -48, -34, -98, -125, 31, -26, 117, 16, 122, -125, 91, -80, -102, 115, 95, 68, -44, 41, -35, -6, -5, -71, 0, 12, -1, 67, 77, -53, -35, -16, -44, -12, -113, 42, 82, -117, -57, 34, 45, 79, 61, -114, 89, 104, -73, 27, 2, 64, -20, -43, -103, -2, -8, 61, -64, 88, -125, 25, -25, -128, 1, 11, -81, 42, 96, -57, -25, 68, 66, 70, 62, -45, -17, -56, -56, 91, -122, 48, -13, -128, -17, -59, 33, 33, 58, 31, 104, -51, 113, 102, 66, 32, 13, -43, -118, -64, -33, -31, -94, -75, -46, -31, -116, 32, -61, 74, -98, -1, -28, -11, 32, -81], "expected": [-128, -75, 127, -95, -128, -56]}
